scene_id	chapter_id	scene_order	objective	opposition	turn	consequence_cost	tension_peak
scene_01_01	chapter_01	1	Survive breakfast without being pulled into open resistance	Martha's pressure, Carrow theatrics, and Owen's instinct to stay unremarkable	Owen pockets the obsolete Binns edition instead of returning it	He begins the day by hiding in scholarship rather than solidarity	NO
scene_01_02	chapter_01	2	Finish detention with minimum pain while stealing reading time	Shattered stacks, Pince's patrols, and the risk of Amycus wandering through	Owen finds the impossible footnote to North Stacks C-13 in the old edition	His attention shifts from the school year's surface miseries to a private line of inquiry	NO
scene_01_03	chapter_01	3	Test whether the footnote points to a real place	Curfew, broken shelving, and the danger of being caught in the Restricted Section	Exposed stone numerals show the modern stacks sit over an older arrangement	Owen commits to investigating the hidden location instead of letting the clue go	YES
scene_02_01	chapter_02	1	Translate the obsolete citation into a current route	Modern catalog charms, missing maps, and curfew pressure	An old prefect guide ties North Stacks C-13 to a retired shelf-chase above the kitchen runs	Owen now has a physical access plan that depends on timing and his body size	NO
scene_02_02	chapter_02	2	Reach the lost shelf and recover whatever the footnote names	A cramped crawlspace, lead-lined concealment, and ward nausea from the coffer	Owen opens the lead box and finds the Grinlow Leaves with pages that describe the First Art	His hand is burned, his wand misfires, and he now carries evidence too dangerous to explain easily	YES
scene_03_01	chapter_03	1	Get help from the Room of Requirement group before the discovery overwhelms him	The resistance's immediate operational needs and Owen's own inability to frame the problem socially	Neville dismisses the pitch, but Prue notices the citation Owen quotes cannot exist	Owen is publicly humiliated and privately marked by the only person smart enough to hear the real anomaly	YES
scene_04_01	chapter_04	1	Extract one usable exercise from the manuscript	Conditional text, blank pages, and Owen's impatience	The pages answer differently once his burned hand touches the margin	Owen realizes the manuscript is reacting to him and not simply being read	NO
scene_04_02	chapter_04	2	Perform the smallest possible amendment on a dead vine	Imprecise instructions and no intuitive feel for how First Art propagates	He changes the local condition of open instead of affecting the vine alone	Latches all through the greenhouse answer the rule-change and chaos starts	YES
scene_04_03	chapter_04	3	Contain the fallout before anyone notices	Cascading hinge failures, startled students, and approaching patrols	Owen sees that the amendment has acted on category rather than target	He understands the work is structurally dangerous even when the effect looks ridiculous	NO
scene_04_04	chapter_04	4	Pass through the evening as if nothing has happened	A deepening palm burn and a wand that no longer obeys simple charms	His basic school magic stutters in public	Owen accepts that the First Art is real and already changing what ordinary magic feels like in his hands	NO
scene_05_01	chapter_05	1	Find out how much Prue actually knows about the footnote	Prue's precise questions and Owen's need to protect the manuscript	Prue proves the citation belongs to a censored printing lineage	Keeping her outside the work becomes less rational than letting her in	NO
scene_05_02	chapter_05	2	Use Prue's overlays to surface more of the manuscript without losing control	Cold, secrecy, and mutual mistrust	Her astronomy transparencies pull the first ward tables into legible form	Owen gains a collaborator and loses the possibility of pretending this is a private hobby	YES
scene_06_01	chapter_06	1	Get through a student roundup without exposing the manuscript	Searches, frightened students, and Martha's demand for honesty	Owen hides a prepared chalk line instead of joining the open protest	He enters the punishment scene already divided between human duty and the work	NO
scene_06_02	chapter_06	2	Keep Martha from taking the full force of Amycus's lesson	Public cruelty, incomplete technique, and no safe time to think	Owen amends contact just long enough for curses to glance and skid	The save is partial and visible, leaving magical and social residue	YES
scene_06_03	chapter_06	3	Understand what the failed-improvised intervention has done to him	Wand recoil, ward hum, and the sense of being observed	The castle answers the amendment like a struck bell	Snape and the deeper sites now have reason to notice Owen specifically	NO
scene_07_01	chapter_07	1	Confirm whether the manuscript's larger claims are materially true	Tallow's taboo, the pain of the route, and the possibility of finding nothing	The East Undercroft reveals the anchor stone and the star-table of the Meridian ward system	The cosmic threat becomes factual, and the school war shrinks in Owen's hierarchy of concern	YES
scene_08_01	chapter_08	1	Rest in a room that is not being used for planning or punishment	Absence at the tables, bad news in the air, and Owen's divided attention	The kitchen meal briefly restores ordinary rhythm and tenderness	The contrast makes later emotional failure sharper	NO
scene_08_02	chapter_08	2	Answer Martha's fear in a way that keeps the friendship human	Owen's inability to speak at the scale of present danger and his growing abstraction	He responds with distance instead of companionship	Martha understands that he is becoming harder to reach even when he is standing beside her	YES
scene_09_01	chapter_09	1	Join the corridor sabotage without revealing his real motive	The DA needs commitment, not half-attention, and Owen wants the route for himself	Martha interprets his agreement as proof he is finally showing up	His private agenda is now tied to a group operation that can be harmed by his secrecy	NO
scene_09_02	chapter_09	2	Plant the diversion and slip toward the undercroft access	Patrol timing, jittery students, and a corridor full of competing objectives	Owen uses a threshold amendment to help himself, but it catches every wrong opening	The plan becomes unstable before anyone knows why	NO
scene_09_03	chapter_09	3	Stop the sabotage from becoming total farce	Armor suits, toilets, doors, and panicked students all behaving by the amended condition	The corridor erupts into comic, dangerous misalignment	Younger students are exposed and the operation is no longer recoverable	NO
scene_09_04	chapter_09	4	Take responsibility or preserve the secret	Amycus's retaliation, Martha's arrest, and Owen's fear of losing the work	Owen stays silent while Martha is taken for punishment	The resistance stops reading him as merely useless and starts reading him as unsafe	YES
scene_10_01	chapter_10	1	Decode the manuscript far enough to understand the full ward problem	Prue's mistrust, exhaustion, and text that only stabilizes under exact handling	Together they map four failing anchors and Prue realizes he may refuse to use future power locally	Owen gains method and loses moral cover with the only person still close to him	YES
scene_11_01	chapter_11	1	Reach Snape's office without panicking	Castle surveillance, rumor, and Owen's fear that the manuscript has already betrayed him	The summons itself confirms the ward scars have been noticed	Owen enters the interview knowing secrecy has already partially failed	NO
scene_11_02	chapter_11	2	Leave the office with both the manuscript and his freedom	Snape's partial knowledge, precision, and capacity for coercion	Snape names pre-wand amendments and warns that the castle answers old work	Owen learns he is not the only mind in Hogwarts with any vocabulary for what he has found	YES
scene_11_03	chapter_11	3	Contain the social damage after being seen with Snape	Neville's suspicion and the optics of private access to the headmaster	Neville treats the meeting as evidence of compromise	Owen loses still more standing with the only organized resistance inside the school	NO
scene_12_01	chapter_12	1	Stay on schedule for the anchor work despite Martha's detention	Martha's immediate danger and the existence of a prepared amendment that could help	Owen decides not to spend the time, strength, or ward stability to intervene	His ethics cross from evasive abstraction into chosen refusal	NO
scene_12_02	chapter_12	2	Explain himself afterward or at least survive being seen	Martha's injuries and her clarity about what he has done	She ends the friendship in terms that strip away his excuses	Owen loses the person most committed to dragging him back to human proportion	YES
scene_13_01	chapter_13	1	Find out exactly what is failing beyond the anchor stone	Flood-cold descent, a damaged star-lens, and the terror of being right	The Departure Chamber shows that battle-scale magic at Hogwarts will widen the ward crack	Owen's private project becomes a time-sensitive emergency with the coming battle as trigger	YES
scene_14_01	chapter_14	1	Pass through an ordinary spring school day without surrendering to sentiment	The persistence of homework, growth, and routine beside occupation	Normality feels newly vivid rather than trivial	Owen is reminded what kind of life his choices are eroding	NO
scene_14_02	chapter_14	2	Keep Prue beside him without lying outright	Prue's demand for a humanly proportioned compromise and Owen's inability to make one	Their almost-tender closeness breaks on the fact that he still ranks the war as secondary	Owen loses his last intimate ally	YES
scene_14_03	chapter_14	3	Get battle-contingency route information from Tallow	Tallow's contempt for cleverness without care and his loyalty to the house rather than Owen	Tallow gives the route but withdraws easy warmth	Owen gains access and feels the social cost of how he has used people	NO
scene_14_04	chapter_14	4	Decide whether to climb back toward ordinary loyalties	Memory of Martha and Prue pulling against the urgency of the ward crisis	Owen chooses the work even in private where no one is watching	From this point his isolation is self-authored, not merely imposed	NO
scene_15_01	chapter_15	1	Read Harry's return correctly fast enough to act	Hope, orders, rumor, and the castle's rapid mobilization	Owen understands the coming battle as a ward event before he understands it as a war event	He separates himself inwardly from everyone else's definition of the night	NO
scene_15_02	chapter_15	2	Reach the undercroft before the battle's magical load peaks	Prue's direct appeal, the tide of defenders moving the other way, and the shame of being seen leaving	Owen keeps going past her instead of turning toward the fight	His desertion becomes explicit and witnessed	YES
scene_16_01	chapter_16	1	Prepare the anchor chamber for a working larger than anything he has attempted	Smoke, vibration, exhaustion, and the battle hammering the stone above	The battle itself makes the node visible enough to work on	The ritual window opens only because Hogwarts is under catastrophic stress	NO
scene_16_02	chapter_16	2	Hold the First Art long enough to patch the ward seam	Blood loss, collapsing notation, and backlash through the castle	Owen stabilizes one edge of the breach and uncovers a latent local combat clause	He suddenly has a second valid use for the same hard-won authority	NO
scene_16_03	chapter_16	3	Choose where to spend the attention he has fought to gain	The audible battle above and the knowledge that he could stop it quickly	Owen continues the ward repair and leaves the combat-ending clause unused	He becomes morally answerable for every death the unused clause might have prevented	YES
scene_17_01	chapter_17	1	Force a final decision once Prue reaches the chamber	Prue's knowledge of the work, falling stone, and the active ritual she cannot safely break	Prue sees the dormant clause and understands that Owen is withholding salvation	The choice is no longer private, and the war ends above by other hands while he stays below	YES
scene_18_01	chapter_18	1	Re-enter the school after the battle as if ordinary categories still apply	Bodies, smoke, exhaustion, and people who know enough to judge him	Victory reorganizes the castle around other heroes and other griefs	Owen discovers survival offers no social absolution	NO
scene_18_02	chapter_18	2	Decide whether the hidden work ends with the war	Loneliness, partial success, and the knowledge that the crack is only patched	Owen recommits to the undercroft and the Grinlow Leaves' secret labor	His future narrows into a custodial vocation that costs him ordinary belonging	YES
