scene_id	chapter_id	scene_order	objective	opposition	turn	consequence_cost	tension_peak
sc_17_02	chapter_17	2	Gavin navigates through the battle to find a quieter workspace. A Death Eater attacks him; Gavin reflexively edits the substrate and the curse simply stops being valid	The physical danger of the battle — collapsing walls, fire, combatants — as obstacle to reaching a viable workspace	The reflexive substrate edit against the Death Eater's curse: the spell unravels in midair. The Death Eater stares. Gavin is already past, not having registered the interaction as significant	None to Gavin. The Death Eater has just encountered something outside any magical framework they understand and will likely be too disoriented to process it	NO
sc_17_03	chapter_17	3	Miren finds Gavin working in a classroom during the battle. She demands he help. He admits he could end the war. She says 'Then do it.' He refuses	Miren's moral demand against Gavin's cosmic triage. The two registers of the novel — human and cosmic — meet in the same room	The refusal. Gavin explains that the ward failure makes the war a rounding error. Miren sees what he has become: not a villain, not a coward, but a person whose frame of reference has expanded past the point where human-scale suffering registers as the most urgent problem. She leaves	Relational: permanent. The friendship was already broken; this moment confirms that the break is ontological, not just emotional. Miren returns to the battle. Gavin returns to his work	YES
sc_17_04	chapter_17	4	The battle resolves without Gavin's participation. Voldemort dies in the canonical way. Gavin barely notices, absorbed in ward-substrate coupling	The novel's structure — the canonical climax of the war happens offscreen to our protagonist, who is working on something else entirely	The Battle of Hogwarts ends. The defining conflict of the wizarding generation concludes. Gavin is on a different page of the manuscript	The novel's central irony is complete: the war that everyone was in has ended, and the protagonist was never in it	NO
sc_18_01	chapter_18	1	Miren visits Gavin in the sub-collection after the battle. They talk carefully. She tells him who died. She asks about the wards. For the first time, she believes him	The changed shape of their relationship — they do not know how to talk to each other anymore. The grief of the aftermath presses on every word	Miren's belief: not understanding but acceptance. She has seen the curse dissolve, seen his eyes tracking invisible things, watched him refuse to save lives with apparent serenity. She believes the reality even if she cannot perceive the substrate. She asks if he will fix the wards. He says he does not know	Relational: the friendship has transformed into something else — not repaired, not ended, but reconfigured around the asymmetry of what they can each see	NO
sc_18_02	chapter_18	2	Gavin alone with the manuscript. Morning light through battle-damaged stone. The wards overhead, visible only to him, thinner than yesterday but holding. The thing beyond, patient as geology	None. The opposition is existential: the wards are failing and Gavin is mediocre and the problem is immense and he is the only one working on it	Gavin turns a page. The notation shifts. He reads. The novel closes not on resolution but on the beginning of the real work	Open: the human story has concluded. The cosmic story is barely begun. Gavin has committed to a task that may be impossible, and the novel ends on the first morning of that commitment	YES
